{
  "readRequest": {
    "materialIds": [
      "material-fixture"
    ]
  },
  "read": {
    "items": [
      {
        "id": "material-fixture",
        "revision": 1,
        "attachments": []
      }
    ]
  },
  "add": {
    "commandId": "1792886400000-33333333-3333-4333-8333-333333333333",
    "action": "video-add",
    "data": {
      "id": "material-fixture",
      "revision": 1,
      "items": [
        {
          "kind": "video",
          "mediaRef": {
            "provider": "server",
            "assetId": "11111111-1111-4111-8111-111111111111"
          }
        }
      ]
    }
  },
  "remove": {
    "commandId": "1792886400000-33333333-3333-4333-8333-333333333333",
    "action": "video-remove",
    "data": {
      "id": "material-fixture",
      "revision": 2,
      "assetId": "11111111-1111-4111-8111-111111111111"
    }
  },
  "replace": {
    "commandId": "1792886400000-33333333-3333-4333-8333-333333333333",
    "action": "video-replace",
    "data": {
      "id": "material-fixture",
      "revision": 2,
      "assetId": "11111111-1111-4111-8111-111111111111",
      "mediaRef": {
        "provider": "server",
        "assetId": "22222222-2222-4222-8222-222222222222"
      }
    }
  },
  "reorder": {
    "commandId": "1792886400000-33333333-3333-4333-8333-333333333333",
    "action": "video-reorder",
    "data": {
      "id": "material-fixture",
      "revision": 2,
      "assetIds": [
        "11111111-1111-4111-8111-111111111111"
      ]
    }
  },
  "result": {
    "id": "material-fixture",
    "video": {
      "id": "material-fixture",
      "revision": 2,
      "attachments": [
        {
          "kind": "video",
          "position": 0,
          "mediaRef": {
            "provider": "server",
            "assetId": "11111111-1111-4111-8111-111111111111"
          }
        }
      ]
    },
    "replayed": false
  },
  "operationRequest": {
    "commandId": "1792886400000-33333333-3333-4333-8333-333333333333"
  },
  "operationFound": {
    "found": true,
    "result": {
      "id": "material-fixture",
      "video": {
        "id": "material-fixture",
        "revision": 2,
        "attachments": [
          {
            "kind": "video",
            "position": 0,
            "mediaRef": {
              "provider": "server",
              "assetId": "11111111-1111-4111-8111-111111111111"
            }
          }
        ]
      },
      "replayed": false
    }
  },
  "operationMissing": {
    "found": false
  }
}
